English Name,Korean Name,Link,Ingredients with Quantity,Ingredients without Quantity,Making Steps
Thick soybean paste stew,°­µÈÀå,https://www.maangchi.com/recipe/gang-doenjang,"2 teaspoons vegetable oil, 4 ounces of ground beef, 4 ounces of clams (or shrimp), chopped, 4 cloves garlic, minced, 1 large potato, peeled, cut into ¨ù inch cubes (about 1¨ö cup), 1 large onion, cut into ¨ù inch chunks ((about 1¨ö cup), zucchini (about ¨ö cup), cut into ¨ù inch cubes, 2green chili peppers, chopped, 1 or 2 green onions, chopped, ¨ö cup Koreanfermented soybean paste (doenjang), 1 cup water, 1 squash blossom (optional), washed and sliced a few times","clams, doenjang, garlic, green chili pepper, green onion, ground beef, onion, potato, shrimp, squash blossom, vegetable oil, water, zucchini,","Heat an earthenware pot or a sauce pan that can hold at least 6 cups over medium high heat. Add the vegetable oil, ground beef, clams, and garlic. Stir with a wooden spoon for about 2 minutes until the beef is no longer pink. Add potato, onion, green chili pepper, and zucchini and stir for about 3 minutes until the potato looks half translucent. Add water and soybean paste. Stir the bean paste so its well mixed in. Cover and boil for 10 minutes over medium high heat, stirring it a few times with the wooden spoon. Open and turn up the heat to high heat and cook another 5 minutes, stirring occasionally to keep the bottom of the pot from being burnt, until its nice and a little thick. Sprinkle with green onion and garnish with squash blossom if you use it. Remove from the heat and serve right away withwhite fluffy riceormulti-grain riceand a variety of lettuce. You can keep the leftovers in the fridge for up to 3 days, and then reheat on the stove or in a microwave oven before serving."
Pan-fried perilla leaves with fillings,²¢ÀÙÀü,https://www.maangchi.com/recipe/kkaennip-jeon,"15 medium sizeperilla leaves (kkaennip), washed and strained, 8 ounces ground beef (or ground pork), 1 garlic clove, minced, 1 green onion, chopped, 2 tablespoons chopped onion, 1 tablespoonsoy sauce, ¨ö teaspoon sugar (optional), ¨ù teaspoon ground black pepper, 1 teaspoontoasted sesame oil, 2 eggs, beaten with a pinch ofkosher salt, 3 tablespoons flour, vegetable oil","flour, garlic, green onion, ground beef, ground black pepper, hot pepper flakes, kosher salt, onion, perilla leaves, soy sauce, sugar, toasted sesame oil, toasted sesame seeds, vegetable oil, vinegar,","Combine beef, garlic, green onion, and onion in a bowl. Add soy sauce, sugar if you use, ground black pepper, and toasted sesame oil. Mix it by hand until its well incorporated and turns into a sticky lump. Cover and keep in the fridge until were ready to use it. Strain the beaten egg through a mesh strainer over a bowl. Let it sit on the counter until were ready to use it. Put flour on a cutting board and one by one, press both sides of each leaf into the flour to coat. Take the meat out of the refrigerator. Unwrap and put about 1 tablespoon  meat mixture into the inside of a leaf, thinly covering one half of it. Fold the leaf over to make a packet. Repeat with the rest of the perilla leaves and the meat mixture. Heat up a large non-stick skillet with some vegetable oil over medium heat. Take a packet and dip into the egg so its totally covered, and place it onto the skillet. Add more packets until the skillet is full, but the packets arent crowding each other. Cook for a few minutes until lightly crisp, about 2 minutes. Flip and cook another one or two minutes until the other side is lightly crisp. Add more oil if necessary. Flip and cook another minute or two minutes until both sides are crisp. Remove from the heat. If you need to cook in batches, clean the pan with a paper towel before re-oiling and cooking the next batch. Make the dipping sauce by combining all the dipping sauce ingredients and mixing well. You can garnish with a few bits of chopped green onion. Serve together. To eat, dip a pan-fried perilla leaf into the sauce and eat."
Three color sandwich,»ï»ö»÷µåÀ§Ä¡,https://www.maangchi.com/recipe/samsaek-sandwich,"1 english cucumber, chopped (about 2 cups), ¨ö teaspoonkosher salt, 2-3 tablespoons mayonnaise, ¨ù teaspoon ground black pepper","eggs, english cucumber, ground black pepper, ham, kosher salt, mayonnaise, mustard, white bread,","For the green filling, mix the cucumber and salt together in a small bowl and let it sit for 10 to 15 minutes, until they sweat. Squeeze out any excess water with cotton cloth from the cucumber. Put the squeezed cucumber back into the bowl, and mix with the pepper and mayonnaise. For the yellow filling, break the yolks with a spoon in a bowl and mix in all the ingredients. For the red filling, mix all the ingredients in a small bowl. Lay 3 slices of bread on your cutting board, side by side. Divide the egg mixture into 3 portions and spread a portion on each slice. Add a slice of bread on top to each. Divide the cucumber mixture into 3 portions and spread a portion on each slice again. Add three more slices of bread. Divide the ham mixture into 3 portions and spread a portion on each slice. Add three more final slices of bread, to make a sandwich stack. Gently press each stack with your hands and cut off the bread edges. Cut each sandwich in half to make a total of 6 sandwich pieces. Serve on a plate or pack it in a lunchbox for later. Be sure to save the leftover edges, and eat them as-is or bake them for 10 minutes at 350 Fahrenheit until they are lightly crispy."
Bean porridge,ÄáÁ×,https://www.maangchi.com/recipe/kongjuk,"2 cups (about 11 ounces) of soakeddried split green peas, 1 or 2jujubes, 7 or 8pine nuts, 1 tablespoon honey, 1 teaspoonkosher salt, 2 teaspoons vegetable oil","glutinous rice flour, honey, jujubes, kosher salt, pine nuts, potato starch, split peas, vegetable oil, water,","Put the soaked beans into a thick pot and add 2 cups of water. Cover and boil over medium heat for 1 hour, or until soft and tender enough to mash. Stir with a wooden spoon occasionally. If you use frozen soaked beans, it will actually take less time, from 30 to 40 minutes. Mash the beans with a wooden spoon and put them into a strainer over the pot. Little by little, add 3¨ö cups water to the beans as you stir and press them through the strainer with a wooden spoon. Discard the rough stuff and lumps, and add ¨ù cup glutinous rice flour to the peas in the pot. Stir well. Hold a jujube in one hand and your knife vertically in the other. Push it into the jujube until you can feel it touching the seed. Turn the jujube as you work your knife around the seed, to separate it from the jujube fruit. Flatten the jujube fruit onto your cutting board, sticky side up. Put some some pine nuts on the edge and press them into the jujube. Roll the jujube around the nuts. Squeeze it tightly so it holds together, then cut it crosswise into slices. Combine ¨ö cup glutinous rice flour, ¨ù teaspoon kosher salt, and ¨ù of cup hot water in a bowl. Mix with a wooden spoon until the dough cools down enough to be handled with your hands. Knead the dough by hand for about a minute until smooth. Wrap it in plastic wrap and set aside for about 10 minutes. Dust your cutting board with potato starch. Divide the rice cake dough into 2 equal pieces, and flatten each piece on your cutting board into disks about 4 inches in diameter, getting them well dusted in the process. Layer one disk on top of the other and cut them into two squares, then four rectangles, about 2 inches by 1 inch pieces. Press the leftover dough together into a lump and make small rice cake balls with it. Dust them with starch and set aside. Heat a skillet with 2 teaspoons of vegetable oil. Fry the 4 rectangular rice cakes for 1 minute over medium heat. Turn them over and cook another minute. Turn down the heat to low and keep cooking until both sides get crispy. Bring the bean porridge to a boil. Add the rice cake balls and 1 teaspoon kosher salt. Cook for another 3 minutes until the porridge is bubbling and the rice cake balls are fully cooked. Ladle the porridge into 2 bowls. Gently lay 2 fried rice cakes on top of the porridge of each bowl. Set some jujube garnishes on top of the rice cakes. Serve hot."
"Sweet, chewy, doughnut balls filled with sweet red beans",Âý½Òµµ³ÊÃ÷,https://www.maangchi.com/recipe/chapssal-doughnuts,"1 cupglutinous rice flour (aka sweet rice flour, Mochiko powder, orchapssalgaru), 1 tablespoon flour, ¨ù teaspoon baking soda, ¨ù teaspoonkosher salt, 1 tablespoon sugar, 1 tablespoon unsalted butter, melted, ¨ù cup plus 3 tablespoons hot water","azuki beans, baking soda, butter, corn syrup, flour, glutinous rice flour, kosher salt, rice syrup, sugar, vanilla extract, vegetable oil, water,","Combine glutinous rice flour, flour, kosher salt, baking soda, and melted butter in a large bowl. Add hot water and mix with a wooden spoon for 1 minute. Form it into a lump as it gathers together. Knead the lump by hand for 2 minutes, until smooth. Put it in a plastic bag to keep it from drying out. Wash the azuki beans in cold water and strain. Put them into a solid, heavy-bottomed pot. Add 7 cups of water. Cover and boil for 30 minutes over medium high heat. Turn off the heat and let the beans soak in the hot water for 30 minutes. Turn on the heat to medium and cook for 1 hour until the beans are very soft. Remove from the heat and mash the beans with a wooden spoon or potato masher. Add 3 cups of water and stir into a watery paste. Set a strong mesh strainer over a large bowl and strain the paste through it to remove the bean skins. Use your hands to squeeze every drop out of the skins as best you can. Discard the empty skins and wash the strainer to use it again. Put the strainer over an empty bowl and line it with a clean cotton cloth. Strain the paste by pouring it through the cloth and strainer. Lift up the edges of the cloth and gently squeeze it to force the all water through. When all the water has passed, youll be left with a solid lump of finely ground, cooked beans inside the cloth. Put it into the pot, and turn the on heat to medium high. Add sugar, rice syrup, kosher salt, and vanilla extract. Stir well with a wooden spoon for about 6 to 7 minutes until the bean paste moves together as a lump. Remove from the heat and let cool. Use about 200 grams 7 ounces of the red bean paste for this recipe and freeze rest for another day. Divide the paste into 10 pieces and roll each piece into a smooth ball. Cover with plastic wrap so they dont dry out while you work. Divide the dough into 10 pieces each one about 1 ounce, or 28 grams and roll each piece into a smooth ball. Cover with plastic wrap. Put one of the dough balls on the cutting board and flatten it out with your hand into a disk about 2¨ö inches in diameter. Make a circle with your thumb and forefinger and put the disk on top of it. With your other hand put one red bean paste ball in the center of the disk and push and pull the dough around it, so the red bean ball is completely covered by the dough. Seal the dough gently and tightly around the red bean, and softly roll the ball on your cutting board to smooth out any lumps. Repeat this with the rest of the dough and red beans to make 10 balls. Heat up vegetable oil in a deep pan to 300F 150C. Fry the balls for 6 to 7 minutes over medium low heat, until light golden brown. As they fry, stir gently with a wooden spoon so theyre cooked evenly and dont stick to the bottom of the pot. Strain and let them cool for 1 minute. Roll in sugar to coat, and serve. Finish in several hours, for the best chewiness"
Braised lotus roots,¿¬±ÙÁ¶¸²,https://www.maangchi.com/recipe/yeon-geun-jorim,"1 pound skinned and trimmedlotus roots, 1 teaspoon white or apple vinegar, 1-2 tablespoons vegetable oil, ¨ù cupsoy sauce, 2 cloves minced garlic, ¨ú cuprice syrup(or ¨ö cup sugar), 2 teaspoonstoasted sesame oil, 1 teaspoontoasted sesame seeds","apple vinegar, cider vinegar, garlic, lotus roots, rice syrup, soy sauce, toasted sesame oil, toasted sesame seeds, vegetable oil, vinegar,","Slice lotus roots into ¨ù inch 0.6 cm thick discs. Soak them in cold water for 30 minutes. Boil some water in a pot. Add vinegar and blanch the lotus root slices for 5 minutes, uncovered. Rinse in cold water and strain. Heat up vegetable oil in a heavy non-stick pan. Stir fry the sliced roots for a few minutes until they get a little softer and translucent. Add 2¨ù cup water, garlic, and soy sauce. Stir and cover. Turn down the heat to low, and cook for 40 minutes. Occasionally open the cover and turn them over to brown evenly. Add more water if necessary. Add rice syrup and stir. Cover and let simmer for another 20 minutes. Open and turn up the heat to medium high. Carefully stir and turn over the roots and braise for 10 to 12 minutes, until each slice gets shiny like jelly and almost all the liquid is evaporated. Remove from the heat and stir in sesame oil. Sprinkle with sesame seeds. Serve as a side dish for rice. If you have some leftover, put it in an airtight container and keep it in the fridge up to 2 weeks."
Rice with red beans,ÆÏ¹ä,https://www.maangchi.com/recipe/patbap,"¨ö cupred beans (Azuki beans), 2 cupsshort grain rice, ¨ö teaspoonkosher salt","azuki beans, kosher salt, rice, water,","Rinse the beans in cold water and strain. Put in a heavy pot with 4 cups of water. Boil for 10 minutes over medium high heat. Then turn down the heat and cook for 50 minutes. Strain the beans and reserve the red bean water to make rice with later. Let the water cool down thoroughly. Put the rice into a heavy bottomed pot. Rinse in cold water and drain, then scrub the wet rice with your hand. Rinse and drain a couple of times until the drained water is clear, then drain out the last of the water by tilting the pot as much as you can. Add the cooled down red bean water. We need 2¨ö cups so if you dont have enough make up the difference with clear water. Add the cooked red beans and salt. Let it soak for 30 minutes. Boil for 10 minutes over medium high heat. Open the lid and mix it up from top to bottom so everything is cooked evenly. Cover, turn down the heat to low, and simmer for 10 minutes."
Mung bean porridge,³ìµÎÁ×,https://www.maangchi.com/recipe/nokdu-juk,"1 cupdried and skinned mung beans, ¨ö cuprice, 2 teaspoonstoasted sesame oil, 6 cups of water, 1 teaspoonkosher salt, gim-bugak(optional)","gim-bugak, kosher salt, mung beans, rice, toasted sesame oil, water,","Combine the mung beans and rice in a bowl, and wash and strain a few times. Soak in water for at least 1 hour, then strain. Put the sesame oil into a heated sauce pan. Add the beans and rice and stir with a wooden spoon over medium high heat until the rice turns a little translucent, for a few minutes. Add water, stir and cover. Let it cook for 20 minutes. It will easily boil over, so when it does, half cover it with the lid and let it keep bubbling and boiling. Stir it occasionally to prevent the rice from sticking to the bottom of the pan. Turn down the heat to low and simmer for 5 to 10 minutes until the porridge turns soft, smooth, and a little thicker. Add salt and stir. Ladle the porridge into a serving bowl and crush some gim-bugak over top if you have it. Serve right away, by itself or with kimchi orcold cucumber soup."
Fried seaweed paper coated with glutinous rice paste,±èºÎ°¢,https://www.maangchi.com/recipe/gim-bugak,"14 sheets ofgim (seaweed paper), 1 cupglutinous rice flour, 2¨ö cups of water, 1 teaspoonkosher salt, 3 tablespoonstoasted sesame seeds, 2 tablespoonssilgochu (dried shredded red pepper), optional, cut into small pieces if used., Vegetable oil for frying","gim, glutinous rice flour, kosher salt, shredded red pepper, toasted sesame seeds, vegetable oil, water,","Mix glutinous rice flour, kosher salt, and water in a pan with a wooden spoon until smooth. Stir the mixture over medium heat with the wooden spoon until it thickens and it starts to bubble. Keep stirring until the color of the paste becomes a little translucent. Remove from the heat and let it cool thoroughly. Place a sheet of gim on your cutting board with the shiny part down. Cover one half of it evenly with rice paste, using a brush or your hand. Fold it in half and evenly spread some rice paste on top. Place it in a basket or your electric dehydrator. Repeat this with the rest of gim and rice paste, adding more baskets as needed. Garnish with sesame seeds andsilgochu, if used. Close the dehydrator and set it to drying for vegetables. Every 2 hours, turn off the machine, flip the bugak over, and flatten them out and shape with your hands as needed. Then cover and turn the machine on again, Dry them out for 7 to 8 hours, depending on your machine and your local climate, until theyre very hard and breakable. Spread the bugak out so they can air out, preferably in a sunny breezy spot. Every 2 hours, flip the bugak over, and flatten them out and shape with your hands as needed. Dry them out for 1 to 2 days, depending on the weather and your local climate, until theyre very hard and breakable. Heat up some oil in a skillet to 330 F. You can dip the tip of one piece in the hot oil and if it bubbles, its the right temperature to cook. Pick up a piece with your tongs and place it into the hot oil, garnish part down. Let it fry for 5 seconds and keep it from curling up by holding it down with the tongs on one side and pressing it down with a spatula on the other side, so it fries flat. Itll expand rapidly. Flip it over and fry for another 5 seconds, holding it flat with with the tongs and the spatula. Keep flipping it over every 5 seconds and holding it flat, until its fried and crispy for 20-25 seconds. Put the fried gim-bugak in a strainer over a bowl, and fry all the gim-bugak that you want to serve."
Octopus slices with sesame dipping sauce,¹®¾î¼÷È¸,https://www.maangchi.com/recipe/muneo-sukhoe,,"kosher salt, octopus, toasted sesame oil, toasted sesame seeds,","If the octopus hasnt been cleaned, youll first need to clean it. Put the octopus in a  bowl big enough to hold it. Gently flip the head inside out. Remove anything attached to the inside of the head, including the ink sac, until its nice and smooth. You can use your fingers or scissors. Theres a film on the inside of the head, remove that, too. During this process, some ink might escape from the sac and it might get black. Dont panic Keep it all in the bowl. When its all clean and smooth, flip the head outside in. Sprinkle salt sea salt or table salt generously over the octopus. Then rub and scrub harshly, like youre cleaning laundry. Keep it up for a few minutes, and it will foam up. Rinse the octopus in cold water a couple of times. If its still slippery or dirty, rub with salt and scrub again until its clean. This process will not only clean the suckers but also tenderize it. Strain the octopus. Bring a large pot of water to a boil. Add the octopus tentacles first. Press it down with a wooden spoon to completely submerge it. Turn it over a few minutes later and bring the head to the bottom. The octopus should have changed color to red. Turn it over every a few minutes to cook evenly. Mix ¨ù teaspoon kosher salt with 2 to 3 tablespoons sesame oil in a small, shallow bowl. Add 1 tablespoon sesame seeds. Take the octopus out of the boiling water. Quickly rinse it in cold water to stop it cooking and to keep the skin smooth and beautiful. Strain and let it cool down. Cut off the head. Split the cluster of tentacles in half. In the middle of both halves will be the mouth and beak. Remove these and discard. Split each tentacle from its cluster. Cut the tentacles into thin slices and serve on a platter with the dipping sauce. Keep leftovers in the fridge for a week or freeze them for up to 1 month. To freeze, divide the octopus into whatever portions you want, then wrap each portion in plastic and freeze. When you want to eat some, take out a portion and let it thaw out a bit, which will make it easier to slice. Then serve with the dipping sauce."
Crunchy balloon bread,°ø°¥»§,https://www.maangchi.com/recipe/gonggal-ppang,"¨÷ cup water, 1 teaspoon sugar, 1 teaspoondry yeast, 1 pinch ofkosher salt, 2 tablespoons vegetable or corn oil, 1 cup of all purpose flour, 1 teaspoonblack sesame seeds(optional), 1 to 2 tablespoons flour for dusting","black sesame seeds, brown sugar, cinnamon powder, corn oil, dry yeast, flour, kosher salt, sesame seeds, sugar, vegetable oil, water,","Make the filling by mixing the sugar, sesame seeds, and cinnamon powder in a bowl. Set aside. Start the dough by combining water, sugar, dry yeast, kosher salt, and vegetable oil in a bowl. Mix well with a wooden spoon. Add the flour and mix it well with the wooden spoon. Knead the dough by hand for about 2 minutes, until its smooth. Let it sit for an hour, covered. Uncover the dough and knead it another minute until its very smooth and soft. Divide the dough into 4 equal size balls. Roll each into a nice smooth ball on the cutting board. Cover the 4 balls with plastic wrap to prevent them from getting dried out while you work. Put a non-stick baking pan into the oven and preheat the broiler. Sprinkle some flour on the cutting board. Take one ball and roll it out with a rolling pin into a 4 inch disk. Add ¨ù of the filling in the center. Lift up the right and left edges of the disc, bring them together, and pinch and seal them together. Then bring the top and bottom edges together too, to make a kind of dumpling. Gently flatten and roll the disc out with your rolling pin, little by little, so as not to break it. Sprinkle some flour as needed so the dough, cutting board, and rolling pin dont stick together. Turn it over and roll it out carefully into a 5¨ö to 6 inch disk. Repeat with the rest of the dough balls. Your oven and the pan inside will be very hot. Change the oven setting from broil to bake. Put each bread disk on the heated pan in the oven. Set the oven temperature to 350 F and bake it for 15 minutes. Check out the color and crunchiness of the bread. If you want it darker and crispier, broil them for 1 minute more. Let them cool down a bit and serve and eat. You can also freeze them up to 1 month."
Bulgogi stew in an earthenware pot,¶Ò¹è±âºÒ°í±â,https://www.maangchi.com/recipe/ttukbaegi-bulgogi,"8 ounces beef skirt steak (or tenderloin, any tender cuts of beef), sliced thinly, 1 tablespoonsoy sauce, 2 garlic cloves, minced, 2 teaspoons sugar, 2 teaspoons honey, ¨ù teaspoon ground black pepper, 1 teaspoontoasted sesame oil, 1 ouncestarch noodles (dangmyeon), soaked in cold water 30 minutes to 1 hour, ¨ö teaspoonfish sauce, ¨ö teaspoonkosher salt, 1 ounce (¨ù cup) onion, sliced, 1 ounce (¨ù cup) carrot, cut into matchsticks, 2 ounces large green onion (or 2 green onions), sliced diagonally., 1 ounce (about ¨÷ cup)Enoki mushrooms, 1 ounce (about ¨ö cup)chrysanthemum greens (ssukgat), washed with the stems removed. If it¡¯s not available, replace it with spinach or some basil leaves., 1 egg (optional), ¨ù cup worth radish sprouts (optional), 1red chili pepper(optional), sliced thinly","beef tenderloin, carrot, edible chrysanthemum, eggs, enoki mushroom, fish sauce, garlic, green onion, ground black pepper, honey, hot pepper flakes, kosher salt, onion, radish sprouts, red chili pepper, skirt steak, soy sauce, sugar, sweet potato starch noodles, toasted sesame oil,","Combine soy sauce, garlic, sugar, honey, ground black pepper, and toasted sesame oil in a bowl. Mix it well until the sugar is dissolved. Add the beef and mix well to marinate. Cover and refrigerate. Place anearthenware pot ttukbaegion the stove with 2 cups of water, kosher salt, and fish sauce. Bring to a boil. When it starts boiling, add the beef, onion, carrot, and the large green onion. Let it cook without the lid for about 10 to 12 minutes over high heat. Stir it a few times and remove any foam from the surface with a spoon. Add the noodles, stirring a few times, and cook for 1 minute. Add Enoki mushrooms and radish sprouts and cook for a few minutes. Crack an egg and put it in the center of the bubbling stew. Garnish with the chrysanthemum greens and the red chili pepper. Remove from the heat and serve with rice, kimchi, and a few more side dishes. If you want the spicy version, put some of the spicy mixture into the stew and mix it in.Vegetarian version Bulgogi mushroom stewThe recipe is almost the same as beef version but the beef is replaced with mushrooms. And in the broth, leave out he fish sauce and increase the salt to 1 teaspoon from ¨ö teaspoon. And skip the egg"
