English Name,Korean Name,Link,Ingredients with Quantity,Ingredients without Quantity,Making Steps
Soybean paste stew with beef,¼Ò°í±â µÈÀåÂî°³,https://www.maangchi.com/recipe/sogogi-doenjang-jjigae,"4 ounces any cuts of beef (or ground beef), cut very thinly, 2 teaspoons vegetable oil, 2 garlic cloves, minced, 4 ounces potato, peeled and cut into ¨ö-inch dice, 4 ounces onion, cut into ¨ö-inch dice, 4 ounces zucchini, cut into ¨ö-inch dice, ¨ù cupdoenjang (Korean fermented soybean paste), 4 ounces medium-firm tofu, cut into ¨ö-inch pieces, 1 green chili pepper or jalape?o, sliced, 1 green onion, sliced, 1 teaspoongochu-garu(Korean hot pepper flakes; optional)","beef, doenjang, garlic, green chili pepper, green onion, hot pepper flakes, onion, potato, tofu, vegetable oil, zucchini,","Place a heavy, medium sized pot over medium heat. When it is hot, add the vegetable oil, beef, and garlic. Cook, stirring, for a few minutes, until the beef is no longer pink. Add 2 cups water. Cover and cook for 10 minutes over medium heat. If it begins to boil over, crack the lid. Add the potato, onion, zucchini, and doenjang. Cover and cook for another 10 minutes. Stir the stew to make sure that the soybean paste is evenly incorporated. Add the tofu, green chili pepper, green onion, and gochu-garu if used. Cover and cook for about 5 minutes, until the tofu softens and the stew is bubbling. Serve right away with rice,kimchi, and more side dishes. You can refrigerate the stew for up to 3 days. When you want to have some, reheat gently on top of the stove."
Ground soybean stew,ÄáºñÁöÂî°³,https://www.maangchi.com/recipe/kongbiji-jjigae,"¨ö cup driedsoybeans(90 grams), washed and soaked in cold water for 12 hours, 8 ounces pork shoulder (pork loin), cut into bite sized pieces, 1 teaspoonsoy sauce, ¨ù teaspoon ground black pepper, 2 teaspoonstoasted sesame oil, 2 garlic cloves, minced, ¨ö cup chopped onion, 1 cup fermentedkimchi, chopped, 1 tablespoonsaeujeot (salted fermented shrimp)(orfish sauce, or 1-2 teaspoons salt to taste), 1green chili pepper(chopped), 1red chili pepper(chopped), 1 mediumdae-pa (large green onion)or 2 green onions, chopped","daepa, dried anchovies, dried kelp, dried soybeans, fermented salted shrimp, garlic, green chili pepper, green onion, ground black pepper, kimchi, large green onion, onion, pork, pork shoulder, red chili pepper, soy sauce, toasted sesame oil,","Put the anchovies and dried kelp in a sauce pan. Add the water and boil for 20 minutes over medium high heat. Strain and set aside. Rinse the beans and drain. They will expand to a little more than 1 cup. Blend the beans with 1 cup water until creamy. You will get about 2 cups ground beans. Heat a heavy, 2 quart pot or Korean earthenware or stone pot over medium high heat. Add the sesame oil, garlic and onion and stir for 30 seconds with a wooden spoon. Add the pork, soy sauce, and ground black pepper and stir for 2 to 3 minutes until the pork is no longer pink. Add the kimchi and stir for 5 minutes until the kimchi turns a little soft. Add 1¨ö cup anchovy kelp stock or chicken or vegetable stock. Cover and cook for 5 minutes. Pour the ground beans over the stew. Gently stir and turn the stew over with a wooden spoon. Cook for another 5 to 6 minutes with the lid open until the beans are fully cooked and bubbling. Taste it to test if the beans are fully cooked. It should taste nutty. Add the salted fermented shrimp or fish sauce or 1-2 teaspoons salt to your taste and stir. You can add the leftover stock if the stew is too thick and you want to thin it out a bit. Add most of the green onion, green and red chili pepper, leaving some back for a garnish. Stir a few times and cook for 1 minute. Add the rest of the green onion, green and red chili pepper as a garnish. Remove from the heat and serve right away with rice and more side dishes."
Spinach side dish,½Ã±ÝÄ¡³ª¹°,https://www.maangchi.com/recipe/sigumchi-namul,"8 ounces spinach, cleaned and washed, 1 garlic clove, minced, 1 green onion, chopped, 1¨ö teaspoonsoy sauce, 1¨ö teaspoontoasted sesame oil, 2 teaspoontoasted sesame seeds, silgochu(Korean dried shredded red pepper), optional","garlic, green onion, sesame seeds, shredded red pepper, soy sauce, spinach, toasted sesame oil,","Boil 8 to 10 cups of water in a large pot. Blanch the spinach for 30 seconds to 1 minute with lid off, stirring with a wooden spoon. Strain the spinach and rinse in cold water a couple of times to remove any residual dirt. Squeeze out excess water and cut a few times into bite size pieces. Mix the spinach with garlic, green onion, soy sauce, toasted sesame oil, and sesame seeds in a mixing bowl by hand. Transfer to a bowl or plate and garnish withsilgochu, if used. Serve with rice."
Iced coffee,³ÃÄ¿ÇÇ,https://www.maangchi.com/recipe/naeng-keopi,"1 tablespoon instant coffee, 2 tablespoons powdered creamer, 1 tablespoon honey (or sugar), 1 cup cold water, 1 cup ice cubes","ice, instant coffee, powdered creamer, water,","Combine the coffee, powdered creamer, honey, and the water in a quick shaker. Cover and shake for about 30 seconds Until mixed well. Pour into a glass and add the ice cubes. Stir well and serve. Combine the coffee, powdered creamer, and honey in a glass. Mix with the hot water with a spoon until well mixed. Add the cold water and ice cubes. Stir well and serve."
Soju Watermelon Cocktail,¼ö¹Ú¼ÒÁÖ,https://www.maangchi.com/recipe/subak-soju,"2 small seedless watermelons, kept in the fridge, 2 bottles ofsoju, kept in the fridge (about 4 cups¡¯ worth), 2 cups of ice cubes","ice cubes, soju, watermelon,","Cut off the top of watermelon. Scoop the flesh out with a spoon and put it in a blender. Set aside the watermelon bowls. Blend the watermelon flesh for 1 minute, until smooth. Set a fine-mesh strainer over a bowl and pour the blended watermelon through it. Press down with a spoon to strain it well. Discard the pulp. Remove the foam from the top with a spoon. Measure 4 cups of blended watermelon juice and put it into a pitcher. Add 4 cups of soju and mix well. Pour the mixture into the watermelon bowl and add ice cubes. Serve cold with a green onion pancake."
Saury,²ÇÄ¡¹«Á¶¸²,http://www.lampcook.com/food/food_fusion_view.php?idx_no=427,"Water (1/2 cup), cooking oil (1 tablespoon), soy sauce (2 tablespoons), ginger juice (slight), chopped garlic (1 teaspoon), minced garlic (1 teaspoon), red pepper powder (1/2 tablespoon)","Water, cooking oil, soy sauce, ginger juice, chopped garlic, red pepper powder","1. Pour canned saury into the sieve and receive the broth separately. 2. Cut radish into 3cm long and cut it in half. 3. Mix the saury soup in ¨ç to make a sauce. 4. Put radishes in a shallow pot, place saury, and put the sauce evenly and put it on fire. 5. Sometimes, with the lid open, sometimes the stew soup is poured and cooked until the radish is cooked softly."
Chicken,´ßºÒ°í±â,http://www.lampcook.com/food/food_fusion_view.php?idx_no=498,"Red pepper paste (2 tablespoons), leek (1 root), garlic (3 pages), soy sauce (5 tablespoons), red pepper powder (1 and 1/2 tablespoon), ginger juice (1 tablespoon), sesame salt (slightly)","Gochujang, leek, garlic, soy sauce, red pepper powder, ginger, sesame salt, pepper powder","1. Chickens are washed clean and eaten to 8 pieces of bones and evenly sheath. 2. Mix all the seasoning ingredients such as minced green onions, garlic, soy sauce, red pepper powder, and ginger juice. 3. Mix the sauce in the chicken for about 30 minutes. 4. Put oil in the pan and cook it properly so that it is not too crispy on medium heat."
Mushroom,¹ö¼¸¸Å¿îÅÁ,http://www.lampcook.com/food/food_fusion_view.php?idx_no=152,"Onion (30g), potato (30g), pumpkin (20g), mugwort (10g), soy sauce (3 tablespoon), red pepper powder (5 tablespoons), garlic (1 tablespoon), salt (slight), pepper powder (slight)","Onion, potato, pumpkin, wormwood, soy sauce, red pepper powder, garlic, salt, pepper powder","1. Put plenty of water in a pot and boil beef and boil. At this time, add some soy sauce. 2. Once the broth boils, then reduces the medium heat, add sliced potatoes and onions, and add red pepper powder and pepper powder. 3. In the other side, prepare noodles. After boiling the water, add kalguksu and boil it like rice. 4. Keep the broth boiled next to it. It is good to do soy sauce or salt, and add garlic, mushrooms, pumpkin, wormwood, and green onions."
Sputum,°¡·¡¶±²¿Ä¡,http://www.lampcook.com/food/food_fusion_view.php?idx_no=375,"Redpaprika (1/2), Hwangpaprika (1/2), broccoli (slightly), red pepper paste (1 tablespoon), soy sauce (1 teaspoon), chopped garlic (1 teaspoon) , Sugar (2 teaspoon), sesame oil (1 teaspoon), skewers (3 pieces)","Redpaprika, Hwangpar Rica, Broccoli, Gochujang, Soy Soy, chopped Garlic","1. Slice the rice cake into 3cm long and boil it in boiling water. 2. Paprika is sliced on the size of the rice cake and boiled slightly, and broccoli is removed with a small stem and boiled in boiling salt water. 3. Mix the amount of seasoning ingredients to make a sauce. 4. Plug in the skewers in the order of rice cake, paprika and broccoli. 5. Apply sauce to ¨ê and bake it on the grill until the rice cake is ripe."
Bean herbs,Äá³ª¹°¹Ì³ª¸®¹«Ä§,http://www.lampcook.com/food/food_fusion_view.php?idx_no=174,"Red pepper powder (1 tablespoon), salt (slight), sesame oil (slight), sesame salt (slight), chopped wave (slight), chopped garlic (slight)","Red pepper powder, salt, sesame oil, sesame salt, chopped green onions, chopped garlic","1. Bean sprouts are trimmed and removed. 2. Add some salt to boiling water and boil it slightly. 3. Cut the buttercup into about 6cm long and slightly boil it in salt water. 4. Dash bean sprouts and buttercups remove water. 5. Mix red pepper powder, salt, sesame oil, sesame salt, chopped green onions, and chopped garlic to make a sauce. 6. Bean sprouts and buttercups in ¨ë sauce."
Sesame leaf horse kimchi,²¢ÀÙ¸»ÀÌ±èÄ¡,http://www.lampcook.com/food/food_fusion_view.php?idx_no=92,"Red pepper (50g), red pepper (50g), chopped garlic (60g), jujube (10), leek (30g), onions (1/2) Fish sauce (3/4 cup), sugar (1 cup), water (2 cups)","Red pepper, green pepper, chopped garlic, jujube, leek, onion, chopped ginger, anchovy, anchovy fish sauce, sugar, water","1. Wash sesame leaves well and pick them in salt water 4 cups of water, 1.5 tbsp. 2. Put green onions, onions, ginger, anchovies, fish sauce, sugar, and water and boiled them. 3. The peppers are cut off in half, then cut off by 3cm long, and all the ingredients are cut finely. 4. Put the cows of the well -picked sesame leaves, put the stone in the barrel, pour the broth, and refrigerate them."
Carp,À×¾îÂò,http://www.lampcook.com/food/food_fusion_view.php?idx_no=41,"Bean sprouts (200g), buttercup (50g), eggs (1), [sauce] red pepper powder (3 tablespoons), red pepper paste (3 tablespoons), chopped garlic (1 and 1/2 tbsp) ), Water syrup (1/2 tablespoon), ginger (slightly), pepper powder (slight), sesame oil (slight)","Bean sprouts, buttercups, eggs, [sauce] red pepper powder, red pepper paste, minced garlic, miso, starch syrup, ginger, pepper powder, sesame oil","1. Wipe off the carp from the scales and the intestines with a dry cotton beam, then sheath with a diagonal lines, fry it slightly in oil so that it is not broken, and then steamed for 30 to 40 minutes on medium heat. 2. Bean sprouts remove their heads and boil them slightly. 3. Prepare garnish buttercup, egg yolk zidane, red pepper in 6-7 cm long. 4. Apply plenty of seasoned sauce made of ingredients on steamed carp for 10 minutes, then put bean sprouts on the edge and put the garnish prepared."
Soy Soy Tteokbokki,°£Àå¶±ººÀÌ,http://www.lampcook.com/food/food_fusion_view.php?idx_no=249,"Onions (1/2), carrots (1/2), blue peppers (1/2), shiitake mushrooms (3 pieces), soy sauce (2 tablespoons), sugar (1/2 tablespoon), sesame oil (1/ 2 teaspoons), pepper powder (a little), [beef seasoning] soy sauce (3 tablespoons), sugar (1 and 1/2 tablespoon), sesame oil (1 teaspoon), pepper powder (slight), chopped garlic (1/2 )","Onion, carrots, blue peppers, shiitake mushrooms, soy sauce, sugar, sesame oil, pepper, [beef seasoning] soy sauce, sugar, sesame oil, pepper, chopped garlic","1. Mix the amount of seasoned ingredients and make the beef sauce and tteokbokki sauce. 2. The rice cake is called in hot water for about 10 minutes and then the beef seasoning is slightly reduced. 3. Cut onions, carrots, bell peppers, and shiitake mushrooms, and beef and shiitake mushrooms are mixed in beef sauce. 4. Put oil in a frying pan and add beef, shiitake mushrooms and rice cakes. 5. When the beef is cooked, add vegetables and fry the tteokbokki of ¨ç. 6. Put sesame oil and finish it and put it on a plate."
Black,ÈæÀÓÀÚ»ï°èÁ×,http://www.lampcook.com/food/food_fusion_view.php?idx_no=34,"Roasted black sesame (black sesame) (1/2 cup (55g)), peanuts (20 tablets), ginseng (1 root), true rice (1 cup (170g)), leek (1), onions (1/4) , Jujube (3), peppers (5 tablets), pine nuts (3 ~ 5 tablets), salt (slight)","Roasted black sesame), peanuts, ginseng, true rice, leek, onion, jujube, whole peppers, pine nuts, salt","1. Rinse the chicken in a pot and put 2L of water, ginseng, green onions, onions, jujube, and pepper. Boiled chickens are taken out, only flesh is applied and hands are finely torn. The broth is filtered in the sieve, and the ginseng used in the broth is chopped, and the jujube is cut. 2. Wash the glutinous rice for more than an hour, sieve it, and then go to the mixer with 2 cups of water. Peel the peanuts, go to a mixer with a black sesame and 1 cup of water, and then filter it in the sieve. Add 1 cup of water to the shell remaining in the sieve and filter it. 3. Add 3 cups of glutinous rice, chopped chicken, chopped ginseng, and chicken broth in the pot. 4. When the glutinous rice spreads, add black sesame seeds and peanuts, and add jujube, adjust the concentration with 1 cup of water, and then season with salt. The pine nuts are removed and raised as garnish."
Cold rice,Âù¹ä¸ÀÅÁ,http://www.lampcook.com/food/food_fusion_view.php?idx_no=352,"Eggs (1/2), starch powder (6 tablespoons), cooking oil (3 cups), salt (1/2 teaspoon), water (1 tablespoon), sugar (1/2 cup)","Egg, starch powder, cooking oil, salt, water, sugar","1. Drain the corn. 2. Put corn, salt, and eggs in cold rice, mix well, and add starch powder. 3. Create a lobster about 2cm in diameter photo 1 and fry it in cooking oil at 170 . 4. Add 12 cup of sugar in 2 tablespoons of cooking oil and add 1 tablespoon of water to boil until the sugar melts. 5. Mix the fried taste in the syrup of ¨ê."
Ogokju Foodbap,¿À°îÁÖ¸Ô¹ä,http://www.lampcook.com/food/food_fusion_view.php?idx_no=178,"Red beans (20g), sorghum (30g), beef (20g), seaweed (1), buttercup (2 stem), Joe (30g), soy (30g), soy sauce (slight), sesame oil (slight), pepper (slightly) ) Sesame salt (slightly)","Red beans, sorghum, beef, seaweed, buttercup","1. Glutinous rice, Joe, sorghum, beans, and rice are called in water for about 30 minutes. 2. Boiled red beans are boiled in boiling water and cooked for about 12. 3. Mix ¨ç and ¨è to pour red beans and cook rice. 4. Stir in a frying pan with a minced beef. 5. When the five grain rice is done, cool it down. 6. Clean about 70g of five grains and add a little bit of roasted beef in ¨ê inside to hold the shape round."
Bossam Kimchi,º¸½Ó±èÄ¡,http://www.lampcook.com/food/food_fusion_view.php?idx_no=32,"Salt (1 tablespoon), shrimp sauce (1/2 cup), red pepper powder (1 cup), garlic (6 pages), ginger (1 tol)","Salt, shrimp sauce, red pepper powder, garlic, ginger","1. After draining the pickled cabbage, the outer leaves are removed for 6  7 porcelain, and the inside part is sliced to 3  3  0.3cm. Cut radishes into the same size as cabbage. Cut the lampshare, buttercups and shoes into 2.5cm long. 2. Slice the night in a flattened side, slice the jujube finely, and the pine nuts. Soak the oysters in salt water, wash it, drain the octopus legs with salt and cut them into 3cm long. Cut 2 garlic pages and 12 ginger and chop the rest to add amounts of ingredients to make kimchi seasoning. 3. Put cabbage, radish, and kimchi seasonings in a large ball first, then mix fresh, buttercups, flakes, pears, oysters, and octopus to make kimchos. 4. Put the pickled cabbage leaves in a large bowl and fill the mixed kimchos. Put jujube and pine nuts with garnish and cover them one by one with a sheet of cabbage leaves."
Tofu sauce,µÎºÎ¾ç³äÁ¶¸²,http://www.lampcook.com/food/food_fusion_view.php?idx_no=408,"Red peppers (slightly), sesame (slight), soy sauce (1 and 1/2 tablespoon), sugar (1/2 tablespoon), starch syrup (1/2 tablespoon), pepper powder (slight), sesame oil (slight)","Red pepper, sesame, soy sauce, sugar, starch syrup, pepper, sesame oil, red pepper","1. Tofu is sliced from 2cm wide, 3cm long, and 0.5cm thick, sprinkled with salt and eliminated water. 2. Mix the seasoning ingredients to make a sauce. 3. Put the tofu back and forth in a frying pan with cooking oil. 4. Season the sauce thickly and apply to the tofu. 5. Put the chopped red pepper and sesame seeds."
Chungmu Kimbab,Ãæ¹«±è¹ä,http://www.lampcook.com/food/food_fusion_view.php?idx_no=206,"Sugar (2 tablespoons), vinegar (4 tablespoons), canary fish sauce (1 tablespoon), sesame oil (slight), sesame salt (slight), chopped green onions (slight), chopped garlic (slight)","Sugar, vinegar, canary fish sauce, sesame oil, sesame salt, chopped green onions, chopped garlic","1. The squid is removed, and then sliced in a length of about 5cm and sliced in boiling water and soaked in cold water. 2. 1 tablespoon of red pepper powder in squid, 12 tablespoon sugar, 1 tablespoon of vinegar, chopped garlic. Put chopped green onions, sesame oil and sesame salt to put the dirt. 3. Slice it is not large and soak in vinegar for a while. 4. If the radish is cut to some extent, you must squeeze the water. 5. 1 tablespoon of sugar, 2 tablespoons of vinegar, 12 tablespoon of red pepper powder, 1 tablespoon of fish sauce, chopped garlic, chopped green onions, etc. 6. Cut the seaweed half and cut the rice thinly and roll it up and divide it."
Squid,¿ÀÂ¡¾îÇ²¸¶´Ã»êÀû,http://www.lampcook.com/food/food_fusion_view.php?idx_no=258,"Flour (1/2 cup), water (1/2 cup), skewers (8 pieces), soy sauce (2 tablespoons), chopped green onions (2 teaspoon), chopped garlic (1 teaspoon), sesame oil (2 teaspoon) Sesame salt (2 teaspoon), ginger juice (1/2 teaspoon)","Flour, water, skewers, soy sauce, chopped wave, minced garlic, sesame oil, sesame salt, ginger juice","1. Peel the green garlic, wash it thoroughly, and slice it into about 10cm long. 2. Remove bones and ink, peel them, and wash thoroughly. Put a slight sheath in the cuttlefish and cut 2cm wide and the length slightly longer than the green garlic. 3. Mix squid and green garlic and sew it in a twist and bury flour. Put the dough by adding flour and water in a 1 1 ratio. 4. Put the dough on the three twist and bake it and pour the sauce."
Modern jangguk,±Ù´ëµÈÀå±¹,http://www.lampcook.com/food/food_fusion_view.php?idx_no=94,"Beef (30g), anchovy (hand), minced garlic (1 tablespoon), leek (1/4 root), red pepper powder (1 teaspoon), miso (1 teaspoon), red pepper paste (1/2 tablespoon)","Beef, anchovy, chopped garlic, leek, red pepper powder, miso, red pepper paste","1. Modern modern water is washed with water and cut into the right size. 2. Put the beef thinly and mix it with miso and pepper. 3. Put anchovies and water in the pot and start boiling, reduce the fire, boil for 15 minutes, and prepare the anchovies and prepare the broth. 4. Put ¨è beef in another pot and fry it, add broth and boil it. 5. When the soup is boiled, add modernity, add chopped garlic, lukewarm green onions and season with salt."
Egg custard,°è¶õÂò,http://www.lampcook.com/food/food_fusion_view.php?idx_no=201,"Spinach (10g), carrot (1/4), corn inheritance (2 tablespoons), minced wave (1 tablespoon), salt (slight), pepper powder (slight), sugar (1/4 teaspoon), water (1/1/ 2 cups), Chungwon -won flavored teacher (slightly)","Spinach, carrot, corn in pain, minced wave, salt, pepper, sugar, water, Chungjeongwon flavor","1. Drain the water in the corn. 2. Carrots and corn in pain are finely chopped. 3. Spinach puts salt and boils it slightly to remove the water and chopped it. 4. Put eggs, carrots, corn, and chopped green onions on a large ball, salt, sugar, pepper, and shrimp. 5. Put ¨ê in a deep pot and take it in boiling water and steam for 15 minutes on medium heat."
Bulgogi glutinous rice grilled,ºÒ°í±âÂý½Ò±¸ÀÌ,http://www.lampcook.com/food/food_fusion_view.php?idx_no=208,"Oil (1/4 cup), soy sauce (2 tablespoons), pepper powder (slight), sesame oil (slight)","Oil, soy sauce, pepper, sesame oil","1. Prepare beef thinly with sliced bulgogi and add chopped green onions, garlic, sesame salt, pepper, sugar, sesame oil, soy sauce and seasoned for about an hour. 2. Spread the glutinous rice flour on a large plate and bury it evenly in front of the bulge beef. 3. Put plenty of oil in a plaenan pan and grab the beef with glutinous rice flour. 4. Make mustard, vinegar, and sugar, each add 2 tablespoons to make a sauce."
Juksunhoe Raminari Lecture,Á×¼øÈ¸¿Í¹Ì³ª¸®°­È¸,http://www.lampcook.com/food/food_fusion_view.php?idx_no=84,"Eggs (1), red pepper (1), rice water (4 cups), [red pepper paste] red pepper paste (1 tablespoon), sugar (1 teaspoon), vinegar (2 teaspoon)","Egg, red pepper, rice water, [red pepper paste] red pepper paste, sugar, vinegar","1. peel the bamboo shoots, then boil it in rice water or flour water for about 10 minutes to remove the bamboo shoots. 2. Cut the bamboo shoots thinly with a comb pattern to remove the water. 3. Put the buttercup in boiling water, boil it slightly, and remove the water. 4. Divide the eggs into yellow white and put each zidane and slice it thinly with 5cm x 0.5mm wide. Red pepper is also sliced into the same size as the Hwangbaekjidan. 5. Pick up 4 to 5 stems of Chapel Hwangbaekji, and put only one or two red peppers, and then stones with the buttercup stem and finish the end of the buttercups. 6. Make a red pepper paste with the amount of ingredients."
Seafood tofu stew,ÇØ¹°¼øµÎºÎÂî°³,http://www.lampcook.com/food/food_fusion_view.php?idx_no=51,"Eggs (1), kelp (1 chapter), anchovies (one -handed), onions (1/2), clean sources (2 tablespoons), red pepper powder (1 ~ 2 tablespoons), sesame salt (slight), sesame oil (slight)","Eggs, kelp, anchovy, onions, clean sources, red pepper powder, sesame salt, sesame oil","1. Put onions, kelp, and anchovies to 2 cm x 2 cm in a casserole, boil it on low heat, and then boil the kelp and anchovies. 2. When the broth boils, add the clam, the washed midduck, and the shrimp to add the soft tofu and red pepper powder. 3. Season with shrimp soup and add eggs, some sesame oil, and sesame salt to get off the fire."
Pumpkin,È£¹Ú¾çÆÄ±¹,http://www.lampcook.com/food/food_fusion_view.php?idx_no=197,"Leek (5G), red peppers (1/2), miso (one tablet), national incidence (5), salt (slight)","Leek, red pepper, miso, soup, salt","1. Pumpkin is cut into 0.5cm thick. 2. Slice onions into the same thickness. 3. Slice the tofu so small. 4. Slice the leek and red pepper. 5. Loosen the roasted soup with no oil so that the lump of miso is not lumped in the boiled water. 6. When ¨ë begins to boil, add pumpkin, onions and tofu in turn."
Mackerel,°íµî¾îµÈÀåÁ¶¸²,http://www.lampcook.com/food/food_fusion_view.php?idx_no=186,"Mu (1/2), leek (2 roots), hemp broth (7 cups), sugar (3 tablespoons), alcohol (2011-03-04) 50g)","Radish, leek, again soup, sugar, alcohol, soy sauce, mirim, miso","1. Cut the fresh mackerel and trim it. 2. Cut the radish only the size of the fish and then boil it once. 3. Add the kelp water and add the prepared radish and mackerel. 4. Make 6 tablespoons of Mirim, 3 tablespoons of sugar, 50g of miso, 34 cups of alcohol, and 3 tablespoons soy sauce. 5. Primrose for about 2 hours on medium heat. 6. Put the green onions constantly and put it on the mackerel."
Sweet pumpkin mackerel stew,´ÜÈ£¹Ú °íµî¾îÁ¶¸²,http://www.lampcook.com/food/food_fusion_view.php?idx_no=8,"Gochujang (1T), miso (1T), soy sauce (1T), red pepper powder (2T), perilla oil (1T), sugar (1/2T), chopped garlic (2T)","Gochujang, miso, soy sauce, red pepper powder, perilla oil, sugar, chopped garlic","1. Mix soy sauce, chopped garlic, red pepper powder, sugar and perilla oil to make sauce. 2. Pour rice water in a pot and boil it with broth and radish. 3. When the broth boils, go to red pepper paste and miso. 4. Boil the mackerel trimmed to the broth. 5. When the mackerel is slightly cooked, add sweet and onions. 6. Put the sauce prepared in the pot and boil until the mackerel is ripe. 7. Put red peppers and cheongyang peppers at the end and boil one more time."
Kimchi,±èÄ¡Àû,http://www.lampcook.com/food/food_fusion_view.php?idx_no=426,"Flour (1/2 cup), eggs (3 pieces), cooking oil (3 tablespoons), sesame oil (slight), salt (slight)","Flour, egg, cooking oil, sesame oil, salt","1. Kimchi brushes the cow and choppes the stem into 8cm long and 2cm wide to bury sesame oil evenly. 2. The beef is thickerly squeezed and sliced slightly longer than kimchi. 3. The shiitake mushrooms are sliced into 1cm wide, and the bellflower is boiled and divided into half and salted with sesame oil and salt. 4. Plug the prepared ingredients into the skewers, bury the flour, and then apply eggs to oil."
