English Name,Korean Name,Link,Ingredients with Quantity,Ingredients without Quantity,Making Steps
Cinnamon rolls,½Ã³ª¸ó·Ñ»§,https://www.maangchi.com/recipe/cinnamon-rolls,"¨ö cup plus 1 tablespoon unsalted butter, melted, 1 cup milk, ¨ù cup white sugar, ¨ù cup plus ¨÷ cup brown sugar, 1 tablespoon cinnamon powder, 3 tablespoons rice or corn syrup, 1 package dried active yeast (2¨ù teaspoons), ¨ö teaspoon plus pinch ofkosher salt, 2 eggs, 2 teaspoons vanilla extract, 3 cups plus ¨ù cup all purpose flour, 1 cup cleaned and toasted walnuts (see below for how to clean and toast walnuts), 2 to 3 ounces raisins, optional","brown sugar, cinnamon powder, corn syrup, dry yeast, eggs, flour, kosher salt, milk, raisins, rice syrup, unsalted butter, vanilla extract, walnuts, white sugar,","Put the walnuts in a bowl and fill it up with cold water. Gently rub them in the water with your hands. Rinse and drain a couple of times until the water is clear, then drain well. Dry them well with paper towels or kitchen towel. Put them on a microwave-safe plate in a thin, even layer. Microwave on high heat for 3 minutes. You can also toast them on apan, stirring with a wooden spoon as needed, for 4 to 5 minutes until light golden brown and crunchy. Heat a large heavy pot over medium heat. Add ¨ù cup butter and stir with a wooden spoon until melted. Remove from the heat. Add the milk and ¨ù cup white sugar. Stir well. Add the dry yeast and let it sit for 5 to 10 minutes until the yeast is frothy. Stir in the eggs, kosher salt, and vanilla extract. Add 3 cups flour and mix it with a wooden spoon for about 1 minute until smooth. The dough should be sticky. Cover and let the dough rise for 1 hour at room temperature until it doubles in size. Deflate the dough by hand and knead it until smooth and soft. Cover and let it rise another 30 minutes. Combine ¨ù cup brown sugar, cinnamon powder, cleaned walnuts, raisins, and a pinch of salt in a bowl. Mix well. Combine ¨÷ cup brown sugar, ¨÷ cup water, and 3 tablespoons rice syrup in a pan. Cook for about 3 minutes over medium heat until the bubbles come up vigorously. Reduce the heat to low and simmer another 3 minutes until it turns a little sticky and shiny. Let cool. Deflate the dough and knead it until its nice and smooth. Use the remaining ¨ù cup flour to dust your dough, cutting board, and your hand. Transfer the dough to the dusted board. Dust your hands with a little bit of flour and spread the dough into a flat rectangle about 13 x 8 inches. Brush the ¨ù cup melted butter all over the dough. Evenly spread the dried filling over top. Grab the bottom edge of the dough and gently roll it up, to make a log. Cut the roll into 9 equal sized pieces. Put the syrup into your baking pan. Swirl it around so it evenly coats the bottom of the pan. I used my 8 x 8 inch square non-stick baking pan. Transfer each section of roll to the baking pan, laying them down in the syrup on their sides. Cover and let it rise for 1 hour. Preheat oven to 350 F 175 C and bake for 25 to 30 minutes until light golden brown. Remove from the oven and brush the last tablespoon of butter over top, to make them shiny. Let the rolls cool for 5 minutes. You can serve them this way, or upside-down, by flipping the pan over a plate and removing it so the sticky syrup is on top of the rolls. Break apart the rolls one by one, add to a serving plate and serve."
Bread rolls,·Ñ»§,https://www.maangchi.com/recipe/bread-rolls,"3 tablespoons butter, ¨ö cup cold milk, 2 tablespoons sugar, ¨ù teaspoonkosher salt, 1 large egg, 2 teaspoonsdry yeast, 1¨ö cups plus ¨ù cup all purpose flour, 1 egg white","butter, dry yeast, eggs, flour, kosher salt, milk, sugar,","Heat the butter in a large heavy pot. Turn off the heat. Add the milk, sugar, and salt. Mix well with a wooden spoon until thoroughly dissolved. Crack the egg, add to the mixture and mix well. Add the dry yeast and let it all sit for 1 minute. Add 1¨ö cupsflour and mix well with the wooden spoon or rice scoop for about 1 minute. The dough will be very sticky. Cover the pot and let it rise for 1 hour until it doubles in size. Deflate and knead the dough by hand for 1 to 2 minutes and cover again. Let it rise for 30 minutes. Deflate and fold the dough for another minute until it makes a smooth dough ball. Place the ¨ù cup flour on the cutting board and sprinkle with some flour. Transfer the dough ball to a dusted cutting board and divide into 6 equal size pieces. Rub a piece of dough between your hands until it forms into a cylinder. Put it on the dusted cutting board and roll it out with both hands until its about 8 inch in length. Coil it around itself and bring the end from the bottom up and over to the top of the coil so you can insert it into the center. The dough is very soft and sticky.When you shape the rolls, dust your fingers with some flour so the rolls dont stick to them.Put it on a non stick baking pan I used 7 x 8 inch pan in the video. Repeat with the remaining dough pieces. Be sure to leave enough room in between the rolls for them to expand. Let it rise for 1 hour. Preheat oven to 350 F for 5 minutes. Gently brush the rolls with the egg white and bake for 15 to 17 minutes until light golden brown. Brush the remaining egg white onto the rolls. Bake another minute. Remove it from the oven and serve hot."
Spicy stir-fried pork and kimchi,µÅÁö±èÄ¡ µÎ·çÄ¡±â,https://www.maangchi.com/recipe/dwaeji-kimchi-duruchigi,"1 pound ofpork belly(or chicken, or beef), cut into ¨ù inch thick bite size pieces, ¨ù teaspoonKosher salt, 1 poundfermented kimchi, chopped, 2 teaspoons plus 1 tablespoontoasted sesame oil, 1 medium size onion, cut into chunks, 1dae-pa (Korean large green onion)or 4 green onions, cut into 1 inch long pieces, 1 small carrot, sliced, 1 small bunch ofenoki mushrooms (pangyee-beoseot in Korean), trimmed and washed (about 1 cup), Lettuce or inner part ofNapa cabbageleaves, washed and drained (optional), One sunny-side-up egg per person (optional)","carrot, daepa, enoki mushroom, fermented kimchi, garlic, gochu-garu, gochujang, ground black pepper, kosher salt, napa cabbage, onion, pork belly, rice syrup, soy sauce, toasted sesame oil, water,","Combine gochujang, gochu-garu, rice syrup, soy sauce, water, garlic, and black pepper in a small bowl. Mx well and set aside. Heat a large pan over medium heat. Add the pork, 2 teaspoons sesame oil, and ¨ù teaspoon salt and stir for about 5 to 6 minutes until the pork is no longer pink and is slightly cooked. Add kimchi and stir in for about 6 to 7 minutes. Add onion, carrot, green onion, and the seasoning paste. Add 1¨ö cups water. Cover and cook for 12 to 13 minutes over medium heat until the pork cooks thoroughly and tender. Occasionally stir well with a wooden spoon. Uncover and add the mushrooms on top as well as the remaining 1 tablespoon sesame oil. Turn up the heat to medium high heat and let cook, stirring for 2 to 3 minutes uncovered. Remove from the heat and serve right away. Place the pork kimchi duruchigi in the center of table with a large serving spoon. Diners take some duruchigi in their own bowl, mix it with some rice, a sunny-side-up egg, and eat. You can also wrap some in a lettuce or Napa cabbage leaf and enjoy it that way too"
Korean ramyeon with rice cake,¶±¶ó¸é,https://www.maangchi.com/recipe/tteok-ramyeon,"2 packages of Korean instant ramyeon, 4 cups water, 1 cuprice cake slices, ¨ö cup fermented kimchi, chopped, 2 green onions, sliced diagonally, 2 eggs","eggs, green onion, kimchi, ramyeon, sliced rice cake, water,","Open the ramyeon packages and take out the packets of soup powder and dried vegetables. In a medium pot, combine water, kimchi, and rice cake slices. Cover the pot and bring it to a boil over medium high heat. Once it starts boiling, continue to cook for an additional 2 minutes. Add the packets of dried vegetables and only 1 packet of soup powder to the pot. Add the noodles to the pot. Cover and cook for about 2 to 3 minutes, until the noodles are half untangled. Use a ladle or a large spoon to stir the ramyeon gently. Add the green onion to the pot and carefully crack the eggs into the boiling ramyeon one by one. Cover the pot again and cook for another 2 minutes, allowing the eggs to poach. Using a ladle, distribute the ramyeon, broth, rice cake slices, and poached eggs evenly into 2 bowls. Serve it immediately."
Spicy raw crab,¾ç³ä°ÔÀå,https://www.maangchi.com/recipe/yangnyeom-gejang,"about 2 pounds ofKorean flower crabs(or blue crabs) shelled and cleaned into 1 pound (details below), 6 cloves garlic, minced, 1¨ö teaspoons peeledginger, minced, ¨÷ cupgochu-garu (Korean hot pepper flakes), ¨ù cupsoy sauce, 1 tablespoon sugar, 1¨ö teaspoonstoasted sesame seeds","blue crabs, flower crab, garlic, ginger, hot pepper flakes, soy sauce, sugar, toasted sesame seeds,","Thaw out the crabs in the refrigerator for several hours, or overnight. Place the crabs in a large bowl. Run cold water over them, and scrub each one with a kitchen brush. Change the water a couple of times while cleaning. Drain. Place one crab belly up on a cutting board. Lift and twist off the flap-like apron. Flip the crab over and remove the top shell. Using your fingers, take off the feathery gills. Cut off the antennae, eyes, mouth parts, and the ends of the back legs that dont have any meat, using scissors. Use a sharp chefs knife to cut the crab body into 4 to 6 pieces and put them in a large bowl. Repeat with the remaining crabs. Rinse the crab pieces in cold water and drain. Crack the claws with the back of the knife, which makes them safer to eat and allows them to absorb the seasoning sauce a little easier. Place the crab pieces in a large bowl. Scoop out the tomalley the greenish digestive gland and roe the orange or red eggs from the top shells with a spoon and put them in a small bowl. Rinse with cold water, drain, and add to the large bowl. Your flash frozen crabs are now ready to be cooked, Add garlic, ginger,gochu-garu, soy sauce, and sugar to the crab in the large bowl. Mix until well combined. Sprinkle with the sesame seeds. Transfer to an airtight container and refrigerate for at least 12 hours you can eat the crab immediately, but it will taste better after it has had time to absorb the sauce. Serve cold as a side dish for rice. Yangnyeom-gejang will keep in the fridge for up to one week. If you want to save it longer than one week you can freeze it, and then when you want to eat it simply thaw it out and eat."
On-the-spot tteokbokki,Áï¼®¶±ººÀÌ,https://www.maangchi.com/recipe/jeukseok-tteokbokki,"2 garlic cloves, minced, The package of soup powder from the Korean ramyeon (instant noodles), ¨ù cupgochu-garu (Korean hot pepper flakes), ¨ù cupgochujang (Korean hot pepper paste), 1 tablespoonchunjang (black bean paste), 1 to 2 tablespoons sugar, ¨ö cup water","cabbage, carrot, chunjang, egg, fish cakes, garaetteok, garlic, gim, hot pepper flakes, hot pepper paste, large green onion, mandu, onion, provolone cheese, ramyeon, rice, smoked sausage, sugar, sweet potato starch noodles, toasted sesame oil, toasted sesame seeds, water, yellow pickled radish,","Combine garlic, soup powder, gochu-garu, gochujang, chunjang, sugar, and water in a medium bowl. Mix well and set aside. In a wide pan or skillet, add the cabbage, onion, half of the green onion, and carrot if used. Add the starch noodles, rice cake, fish cakes, and sausage if used. Add the sauce and place the ramyeon noodles on top of the sauce. Add fried mandu if used and eggs. Sprinkle the rest of the green onion over top. Add water or anchovy kelp stock or vegetable stock, Set 4 individual bowls or plate on the table along with forks, chopsticks, spoons, napkins, and a bowl of danmuji if used. Place the pan on the gas burner at the table. Turn on the heat to high heat. When it starts boiling about 8 minutes later, add the cheese if used. Carefully stir with a large spoon so that all the ingredients are evenly cooked. Ladle an egg into each individual bowl along with a little broth. Occasionally stir the stew and also ladle some rice cake, cheese, noodles, fish cakes, vegetables, and ramyeon into the individual bowls. Cook, eat, and enjoy having fun talking to each other You can reduce the heat to low to keep the broth from boiling down. When you get close to the bottom of the pan, you can make stir-fried rice with the everything there. Add the rice and stir-fry with the ingredients and broth at the bottom of the pan. Finish it off with the shredded gim, sesame oil, and sesame seeds. Remove from the heat and serve by adding some stir fried rice to everyones bowl."
Korean style Vietnamese rice paper rolls,¿ù³²½Ó,https://www.maangchi.com/recipe/wollamssam,"1 small can (8 ounces: 1 cup) of pineapple with the juice, ¨ö cup peanut butter, 2 tablespoons chopped onion, 1 garlic clove, chopped, 1 small serrano pepper (or jalape?o), chopped, 2 tablespoonssoy sauce, ¨ö of a large lemon, squeezed (2 to 3 tablespoons of juice)","avocado, cabbage, canned pineapple, carrot, cilantro, english cucumber, fish sauce, garlic, honey, lemon, lettuce, mango, mung bean vermicelli, onion, peanut butter, perilla leaves, red bell pepper, rice paper, serrano pepper, shrimp, soy sauce,","Place all the ingredients for peanut sauce in a food processor and blend for 1 to 2 minutes until creamy. Transfer to a bowl, cover and refrigerate. Peel and cut off the flesh of a mango from around the stone. Cut the pieces a few times and add them to a food processor. Drizzle the lemon juice and puree until smooth. Cover and refrigerate. Combine fish sauce, honey, garlic, and pepper in a bowl. Mix well. Cover and refrigerate. Bring 3 cups water in a steamer to a boil. Place the shrimp to the steamer basket. Cover and steam for 2 to 3 minutes. Open and flip them over to cook evenly. Cover and steam for another 2 to 3 minutes. Remove from the heat. Transfer to a plate. Bring a small pot of water to a boil. Add the noodles and cook for 3 minutes, stirring a few times until nicely cooked. Drain and rinse in cold running water. Squeeze out the excess water and transfer to a bowl. Cut the noodles several times with kitchen scissors. Mix with 1 tablespoon squeezed lemon juice and a pinch of salt. Place the perilla leaves if used, lettuce, noodles, cucumber, cabbage, carrot, avocado, and cilantro on a large platter. Drizzle 1 tablespoon lemon juice over the avocado to keep it from going brown. Cut off the top and bottom of the bell pepper. Make a slit on one side of the pepper. Remove the seeds and veins and cut the pepper into matchsticks. Put it on the platter. Place the platter on the table along with shrimp. Divide each sauce into 2 servings and put them in front of you and your guest. Set the rice paper on the table but keep it in the plastic package so it doesnt draw moisture from the air. Prepare 2 medium size plates a little larger than the rice paper, one for you, one for your guest. Heat up about 4 cups of water in a shallow pan until warm, but not boiling hot. Put it on the table. Dip a piece of rice paper in warm water and put it on the serving plate. Add lettuce leaves, perilla leaves if used on the rice paper first, and then add everything else you want, closer to the front of the paper. Leave some room on the sides. Gently lift the edge of the paper closest to you and tuck in the sides so that everything stays tightly. Roll it up over the ingredients. Pick up your roll and dip it into one of the sauces. Take a bite, and then spoon some sauce into the end of the roll to prevent double-dipping for your next bite. Keep making wraps and eating them until youve had enough."
Braised beltfish,°¥Ä¡Á¶¸²,https://www.maangchi.com/recipe/galchi-jorim,"1 pound packaged frozen pre-cutbeltfish, thawed out in the refrigerator, 8 ouncesKorean radish(ordaikon), peeled, cut into ¨ù inch thick half-disks, 1 medium onion (about 6 ounces), sliced, 1 green onion, sliced, 1 or 2green chili peppers, sliced","beltfish, daikon radish, garlic, ginger, green chili pepper, ground black pepper, hot pepper flakes, Korean radish, onion, soy sauce, water,","Combine the garlic, ginger, soy sauce, hot pepper flakes, and ground black pepper in a bowl. Mix well and set aside. If using whole fresh fish, remove the head and guts and snip off the fins. Cut the fish into 3 to 4 inch pieces frozen fish will have already been cut. Rinse the fish under cold running water. Remove any intestines, and pull off any of the black film from inside of the fish body. You dont need to wash it too thoroughly. Do it quickly, then rinse and drain and pat dry. Arrange the radish in the bottom of a large heavy skillet. Arrange the onion slices over the radish. Place the pieces of fish on top, side by side. Spoon the seasoning mixture over top of the fish. Add the water along the edges of the skillet so that the seasoning mixture remains on top of the fish. Cover and cook over medium high heat for 15 minutes. Open the skillet and add the green chili pepper and green onion. Spoon some of the broth over top a couple of times. Cover and reduce the heat to medium. Cook for another 15 minutes. Uncover and spoon some of the broth over the top of the fish to season it evenly. Be sure not to move or turn over the fish because its so soft that it will break easily. Reduce the heat to low and simmer for 5 minutes to cook the radish thoroughly. Remove from the heat and serve with rice and more side dishes if you have them."
Spicy cod fillets,´ë±¸»ìÁ¶¸²,https://www.maangchi.com/recipe/daegusal-jorim,"1 pound frozen cod fillets, thawed and cut into about 2¨ö inch pieces, ¨ö teaspoonkosher salt, ¨ù teaspoon ground black (or white) pepper, 2 tablespoonspotato starch(or plain wheat flour), 1 medium onion, sliced, 2 garlic cloves, 1 tablespoonsoy sauce, 2 teaspoonsgochu-garu (Korean hot pepper flakes), a palm-sized piece ofdried kelp, 1 green onion, chopped, 1green chili pepper, sliced, 1 plus ¨ù cup water","all-purpose wheat flour, cod fillets, dried kelp, garlic, green chili pepper, green onion, ground black pepper, hot pepper flakes, kosher salt, onion, potato starch, soy sauce, water,","In a bowl, season the cod evenly with salt and ground black pepper. Let it sit for 30 minutes in the fridge. Pat dry with a paper towel to remove excess water. Coat the cod pieces with the potato starch. Evenly spread the onion and garlic in the bottom of a small pan. Cut the dried kelp into 6 pieces and add it to the pan. Add soy sauce and sprinkle the gochu-garu over the onion. Add 1 cup water. Cook over medium high heat for about 3 minutes until it starts boiling. Reduce the heat to medium. Stir. Add the cod pieces on top, side by side. Cover and cook for 5 minutes over medium heat. Uncover and use a spoon to flip over each piece of the cod. Add the rest of the ¨ù cup of water to the pan. Add green onion and green chili pepper. Cover and cook another 5 minutes over medium heat. Open the lid and scoop some liquid from the bottom of the pan and spoon it over top. Remove from the heat and serve right away with rice and other side dishes."
Kimchi pork ribs,µî°¥ºñ±èÄ¡Âò,https://www.maangchi.com/recipe/deungalbi-kimchijjim,"2 pounds baby back ribs, sliced into individual ribs, 2 to 2¨ö pounds fermented kimchi, 1 large onion (about 8 ounces), sliced, 4 green onions, cut into 2 inch long","fermented kimchi, garlic, ginger, gochujang, green onion, ground black pepper, hot pepper flakes, onion, pork back ribs, rice syrup, soy sauce, toasted sesame oil,","Soak the ribs in cold water for 1 to 2 hours, changing water a couple of times. Drain. Bring a large pot of water to a boil and add the ribs. Cover and cook for 5 minutes until some brownish foam and smelly fat floats to the surface. Rinse the ribs in cold running water and drain. Put them into a large bowl and wash the large pot that the ribs were in. Add all the ingredients for seasonings into the bowl with the ribs and mix it all together by hand. You can wear a rubber glove for this if you want. Place the onion on the bottom of the pot and add the seasoned ribs over top. Then lay the kimchi on top of the ribs. Cut the stem of the kimchi with a kitchen knife or scissors so that the kimchi will be cooked nicely. Add 5 cups of cold water. Cover and cook for 1 hour over medium high heat until the meat is falling off the bone. Open the lid and turn the kimchi over. Add 2 cups more water and the green onion. Reduced the heat to medium and cook for another 10 minutes with the lid on."
Pepper chicken,À¯¸°±â,https://www.maangchi.com/recipe/yuringi,"1 pound boneless & skinless chicken thighs, ¨ö teaspoonkosher salt, ¨ù teaspoon ground black pepper, 2 inch of white part ofdae-pa(or 2 to 3 regular green onions), thinly sliced lengthwise, ¨ù of small onion (about 2 tablespoons), thinly sliced, 2 cups grape seeds oil (or vegetable oil, corn oil) for frying, 4 to 5 lettuce leaves, 3 to 4 spicygreenandred chili peppers(or non-spicy peppers, green and red bell pepper), thinly sliced","chicken thighs, crushed chili peppers, egg, garlic, grape seed oil, green chili pepper, ground black pepper, kosher salt, large green onion, lettuce, onion, potato starch, red chili pepper, soy sauce, sugar, toasted sesame oil, white vinegar,","Pat the chicken thighs dry with paper towels. Score a crosshatch patten on both sides of the chicken pieces. Pound the thighs to an even thickness with a meat tenderizer or with the back of your kitchen knife. Sprinkle both sides with salt and ground black pepper. Set aside or refrigerate until ready to use. Place the shredded green onion and onion in a bowl and add cold water. Let it sit. Heat the vegetable oil in a small pan until it begins to smoke, about 30 seconds to 1 minute. Remove from the heat. Stir in the pepper flakes until they are slightly brown. Strain the oil into a medium sized stainless steel bowl. Add the soy sauce, vinegar, sugar, water, garlic, and sesame oil. Stir well until the sugar is completely dissolved. Prepare a shallow and wide bowl I use my large, shallow plastic bowl. Add the starch and salt. Crack in an egg. Mix well with a spoon or a whisk. Heat the oil in a large, deep pan over medium-high heat until it reaches about 340 to 350 F. If you dont have a kitchen thermometer, test the oil temperature by dipping a tip of a chicken piece into it. If it bubbles, its ready. Dip a chicken piece into the batter and wipe off the excess with the side of the bowl. Add it to the oil one piece at a time, working in batches if your pan is small. My 12 inch large pan is perfect for frying 4 pieces of chicken thighs at a time. Repeat with the rest of the chicken pieces until all are in the pan. Deep-fry, turning the chicken with tongs, until all sides are light golden brown and crunchy, about 5 to 6 minutes. As each piece is done, transfer it to a strainer over a bowl to drain the excess oil. Reheat the oil for about 1 minute and add all the chicken again. It will look a little soggy at first. Deep-fry, turning occasionally, until all the chicken pieces are dark golden brown and very crunchy, another 5 to 6 minutes. Transfer the chicken pieces to the strainer over the bowl to drain. Let them cool for a few minutes until you can handle them. Add the sliced chili pepper to the sauce and mix it together. Drain the soaking green onion and onion through a strainer set in your sink. Rinse it under cold running water, turning it over by hand for 10 seconds. Drain well. Cut the chicken into bite size pieces and put them on a large plate lined with the lettuce. Spoon the peppers out of the sauce and put them on top of the chicken. Add the shredded green onion and onion and gently pour the rest of the sauce all over top. Serve right away."
Spicy pork and vegetables over rice,Á¦À°µ¤¹ä,https://www.maangchi.com/recipe/jeyuk-deopbap,"1 pound pork shoulder (or tenderloin), sliced paper thin, 2 tablespoons vegetable oil, 4 ounces cabbage, sliced, 1 small peeled carrot (about 2 ounces), sliced, 6 green onions, cut crosswise into 2 inch pieces, 1green chili pepper, sliced, 1 medium onion (about 6 ounces), thinly sliced, 4 garlic cloves, minced, ¨ö teaspoon peeledginger, minced, 2 teaspoonstoasted sesame oil, 2 teaspoonstoasted sesame seeds, over easy eggs, optional","cabbage, carrot, eggs, garlic, ginger, gochujang, green chili pepper, green onion, ground black pepper, hot pepper flakes, onion, pork belly, pork shoulder, potato starch, soy sauce, sugar, toasted sesame oil, toasted sesame seeds, vegetable oil, water,","Combine the sauce ingredients in a medium-sized bowl. Mix it well with a spoon. Set aside. Heat up the vegetable oil in a large frying pan over medium high heat. Add the garlic and ginger and stir for a minute with a wooden spoon until they are a little crispy. Stir in the pork and cook for about 2 to 3 minutes until its no longer pink. Add cabbage, carrot, onion, green chili pepper, and onion. Cover and reduce the heat to medium. Cook for 3 minutes until the vegetables are slightly cooked. Uncover and add the seasoning sauce. Increase the heat to medium high and cook another 3 minutes, stirring with the wooden spoon, until everything is nicely cooked and incorporated. Stir in sesame oil and remove from heat. Put some freshly made rice on individual large serving plates. Add the pork and vegetables next to the rice and sprinkle some toasted sesame seeds over top. Add the egg to the top of rice and serve right away. You can serve with a few more side dishes if desired."
